content,query,score
"关注通用照明企业转型进展，关注家电企业动向。关注通用照明转型，以得邦照明、佛山照明为代表的企业近年转型发力车载照明；以立达信为代表的出口企业发力物联网板块，同时扩大海外的泰国制造基地；欧普照明发力医用照明。空调的上游微特电机行业公司华阳智能装备股份有限公司，11月22日得到证监会同意创业板IP0的批复。本周沪深300指数下跌0.84%，长江家用电器指数上涨1.06%，跑赢沪深300指数1.91pct。从细分板块来看，本周长江白色家电、厨卫家电、小家电、黑色家电、照明设备分别+1.28%/+0.57%/-0.62%/-3.61%/-0.19%。子板块核心数据追踪：投资建议。关注通用照明企业转型进展。通用照明行业中以得邦照明、佛山照明为代表的企业，近年转型发力车载照明，得邦照明新披露一个定点项目，为华中马瑞利供应S311车大灯ECU，项目周期3年；佛山照明的子公司南宁燎旺目前已具备DB矩阵大灯，HD/DLP投影大灯、激光大灯等前沿产品的技术。立达信于今年10月决定扩大对泰国的投资，增加泰国智能制造项目，投资额30,317.72万元，该项目将建成照明产品和控制与安防产品等部件及总装生产线35条，建成后相应产品在泰国基地的产能对比现状将提升约110%。欧普照明于10月调研公告中披露，公司与壹智造科技签署战略合作协议，未来将通过专业的医疗行业照明解决方案。关注家电企业近期动向，空调上游企业华阳智能装备股份有限公司准备创业板上市，已于本周获得证监会批复。华阳智能装备股份有限公司是空调领域微特电机领先企业，并实现精密给药装置赛道拓展，客户包括美的、海信、海尔、格力、奥克斯等家电龙头企业及金赛药业、豪森药业、信立泰等知名制药企业。2020~2022年营业总收入分别为3.96/4.99/4.63亿元，CAGR为+8.21%，2020~2022年归母净利润分别为0.60/0.65/0.63亿元，CAGR为+2.56%。经公司初步测算，2023年前三季度营收为3.80~4.20亿元，同比+3.36%~+14.24%，归母净利润为0.46~0.53亿元，同比-3.44%~+11.25%。本周家电板块主要上市公司表现，小崧股份涨幅最大为9.78%，香农芯创跌幅最大为-19.21%。从各主要家电上市公司的2022年初至今股价表现来看：海信视像（85.71%）、四川长虹（84.00%长虹美菱（76.32%）领跑整个长江家用电器指数。5、本周南北向资金一览。白色家电北向资金持股：截至11月25日，北向资金持股比例方面，美的集团较上周减少0.04pct;格力电器较上周增加0.10pct；海尔智家较上周增加0.13pct；海信家电较上周增加0.04pct。黑色家电北向资金持股：截至11月25日，北向资金持股比例方面，视源股份较上周减少0.11pct;海信视像较上周减少0.06pct；兆驰股份较上周增加0.06pct；创维数字较上周减少0.02pct；四川长虹较上周增加1.06pct。厨卫家电北向资金持股：截至11月25日,北向资金持股比例方面，老板电器较上周减少0.01pct;华帝股份较上周减少0.03pct；火星人较上周增加0.04pct；浙江美大较上周增加0.08pct；日出东方较上周增加0.26pct；万和电气较上周增加0.14pct。小家电北向资金持股：截至11月25日，北向资金持股比例方面，九阳股份较上周增加0.01pct;苏泊尔较上周减少0.08pct；飞科电器较上周增加0.06pct；小熊电器较上周减少0.18pct；新宝股份较上周增加0.07pct；莱克电气较上周维持不变。照明类电器北向资金持股：截至11月25日，北向资金持股比例方面，公牛集团较上周增加0.07pct欧普照明较上周增加0.05pct；佛山照明较上周增加0.69pct；阳光照明较上周维持不变。按摩器材北向资金持股：截至11月25日，北向资金持股比例方面，奥佳华较上周增加0.11pct;荣泰健康较上周维持不变。扫地机器人北向资金持股：截至11月25日，北向资金持股比例方面，石头科技较上周增加0.068pct；科沃斯较上周减少0.123pct。2冷链相关北向资金持股：截至11月25日，北向资金持股比例方面，海容冷链较上周减少0.026pct;冰轮环境较上周减少0.043pct；四方科技较上周维持不变；盾安环境较上周减少0.187pct；雪人股份较上周增加0.065pct；汉钟精机较上周增加0.188pct。1、家电终端零售数据追踪（1）月度数据①白色家电和彩电：1、家电终端零售数据追踪（1）月度数据①白色家电和彩电：18.冰箱月度销售额同比变化：23年10月线下、线七上升27.6%、上升10.63%。厨房电器：③小家电：5厨房电器：?小家电：2、家电行业原材料数据更新。2、家电行业原材料数据更新。本周LME3个月铜上涨1.94%，铝上涨0.61%，铅下跌3.33%，锌下跌0.66%。镀锌板价格方面，截至11月25日，镀锌板（0.5，含税价）为5175元每吨，较上周上涨0.91%。冷轧板卷价格方面，截至11月25日，冷轧板卷（1mm,上海）价格为4730元/吨，较上周上涨0.21%塑料价格方面，中国塑料城价格指数截至11月25日为838.73，较上周下跌0.06%。液晶面板价格方面，12月，32寸面板价格环比下降5.56%，43寸面板价格环比下降4.84%，寸面板价格环比下降3.88%。58.本周LME3个月铜上涨1.94%，铝上涨0.61%3.33%，锌下跌0.66%。59.截至11月25日，镀锌板（0.5，含税价）为5吨，较上周上涨0.91%。【格力电器：完成机器人运动控制系统研制，伺服电机技术达国际领先】格力电器在互动平台表示，公司已完成机器人运动控制系统研制，并实现高精度控制及稳定运行，SCARA机器人关键零部件的自主化已达到行业一流水平并批量生产。格力自主研发的工业机器人用高性能伺服电机及驱动器，技术达到“国际先进”水平，其中伺服电机功率密度、过载能力等指标达“国际领先”。（金融界)核心公司公告【澳柯玛：九届五次董事会决议公告】澳柯玛股份有限公司于2023年11月21日召开了其第九届第五次董事会，由公司董事长主持，并保证了会议的合法合规性。在此会议上，董事会成员一致通过了成立澳柯玛墨西哥电子有限公司的提案，以便更好地拓展墨西哥市场。新公司将以澳柯玛（美国）贸易公司和澳柯玛（香港）贸易有限公司的共同出资在墨西哥城注册，注册资金为50万美元，股权结构中澳柯玛（美国）贸易公司持有80%，澳柯玛（香港）贸易有限公司持有20%。该公司将负责销售包括冰箱、冷柜、洗衣机、空调在内的各类家电产品，并提供国际贸易经纪服务。此举是澳柯玛“走出去”发展战略的一部分，旨在完善其海外业务布局。根据国有资产管理规定，公司还需完成向国有资产监督管理部门的相关报批手续。【惠而浦：2023年第三季度权益分派实施公告】惠而浦（中国)股份有限公司发布了2023年第三季度的权益分派公告，宣布将根据总股本766,439,000股，向股东每股派发0.71元人民币的现金红利，总计544,171,690元。该分配方案已在2023年11月15日的股东大会上获批。重要日期包括股权登记日（2023年11月28日）和除权（息）日及现金红利发放日（2023年11月29日）。股东分配对象为在股权登记日结束时在中国证券登记结算有限责任公司上海分公司登记的所有股东。红利的发放将由中国结算上海分公司处理，而特定股东如广东格兰仕家用电器制造有限公司、惠而浦（中国）投资有限公司、合肥市国有资产控股有限公司将由公司直接发放。关于税务，个人股东和证券投资基金的税收处理将遵循相关政策，而合格境外机构投资者（QFII）和沪股通投资者的红利税率定为10%。居民企业股东需自行判断并缴纳企业所得税。",2022-2023年格力营销投入,0
高股息策略的长期稳定回报。高股息策略具有长期稳定回报，海外和国内高股息策略的年化收益率约为10%，并且与其他板块相关性较弱，在市场弱势中表现较好。高股息策略适用于宽松流动性和弱势市场环境。投资者在选择高股息股票时需要关注公司的分红能力，避免价值和杠杆分红陷阱。目前的投资环境对高股息策略较为有利，监管政策鼓励上市公司多分红，减持新规使得分红数量增加，中长期来看高股息策略是一个有效的投资策略。保险资产配置与高股息策略。保险公司股票和基金投资分类发生了变化，大部分股票现在放在可供出售金融资产（FVTPL）科目，而中国平安将67%的股票放在以公允价值计量且其变动计入其他综合收益（FVOCI）科目，偏好高股息股票。保险公司的业绩波动增大，受到新会计准则的影响，与股市波动高度相关。预计保险公司的权益配置比例会维持在12%-13%左右，每年增加约2000-3000亿，趋向增配高股息股票。股息吸引力与行业前景。当前高股息股票的股价已经部分反映在市场上，但即使业绩下降50%，6-7%的股息率仍具有吸引力。煤炭行业是一个具有较强盈利能力的行业，近年来资产负债表持续改善，分红能力和意愿均较强。淮北矿业、中煤能源和陕西煤业等公司是煤炭行业的重点推荐。未来煤炭价格可能在较高水平稳定，为煤炭企业的分红提供基础。高股息汽车零部件股的关注。骆驼股份公司作为全球蓄电池头部企业，在前装和售后市场占率高，产品向更高值版块迈进，其稳定的业务模式和市场地位能支持持续高股息。华域汽车作为中国大型零部件企业，在优化客户结构后，业绩波动减小，现金流充裕，其5.5%左右的高股息被看作是可持续的。潍柴动力虽有周期性，但议价能力强，能实现稳定利润增长，且通过扩展高端设备分散风险，具备良好的抗风险能力和现金流水平，高股息亦有潜力持续。能源与化工投资策略。在家电行业中，重点推荐白电龙头（美的、海尔、格力、海信家电）和部分小家电、厨电龙头，基于其业绩稳健及股息可持续性与当前估值水平。在石油化工行业中，偏向能源资源的高股息标的受到更多关注，特别是三桶油（中海油、中石油、中石化）估值较低，盈利稳定性提升，股息率在5-7%之间，特别是中石化，市净率仅为0.8倍，股息率约为7%，是高股息的优选标的，新奥股份及恒力石化也值得关注。整体投资策略偏好资源板块和成分稳健的上游资源股票以及产品盈利改善的下游化工股票。电力行业逻辑与增长展望。公用事业板块逐渐符合高股息策略，去年业绩有所好转，部分火电公司可能重回高股息视野，受到用电增长趋势的支撑。预计煤炭价格中枢将在800左右，电力公司的盈利增长空间预计为50%~100%。电力公司的股息率较高，未来两年有望提升，华能国际、华电国际、浙能电力、国电、深能、皖能电力等公司值得关注。造纸与电动两轮车股息策略。造纸行业的展望预计从2024年底开始，投资逻辑将从周期性转向稳定性。,2022-2023年格力营销投入,0
内销出货量稳步增长。2023年全年空调内销出货量达到9960万台，同比增长14%，创历史新高。其中，1Q23、2Q23、3Q23和4Q23的内销出货同比增长分别为17%、30%、1%和2%。尽管4Q23受到高基数的压力，但逐渐开始恢复。海信在内销竞争中表现突出。2023年全年美的、格力、海尔和海信的内销出货量同比增长分别为9.5%、4.1%、17.6%和34.9%。一线厂商表现稳健，而海信等二线厂商在低基数下展现出较大的弹性。相对于2019年历史同期高点的增长率为8%，海信在2023年内销市场份额提升0.8个百分点，达到5.0%。二线厂商在良性竞争环境中修复弹性增强。二线厂商面临较大的经营压力，在2019年后的空调下行周期中表现不佳。然而，2022年热夏期间，二线厂商开始展现出较大的出货弹性。在当前的空调顺周期环境下，相对良性的竞争环境、较低的销售基数、渠道库存和利润率水平都赋予了二线厂商更强的修复弹性。内销市场份额分布情况。2023年全年累计空调内销CR3为72%，同比下降6.5个百分点。海信和TCL等二线品牌自2022年年底开始积极扩产，份额提升明显。其中，海信在2023年内销市场份额提升0.8个百分点，达到5.0%。零售量逐渐改善。2023年空调全渠道零售量同比增长6.5%，创历史新高。4Q23的同期基数压力减轻，空调零售开始环比改善，全渠道零售量同比增长6.5%。2024年零售端景气度延续。2024年以来，空调零售端景气度延续。AVC数据显示，2024年1-2月累计家用空调线上零售额同比增长41%，线下零售额同比下降28%。二线厂商在零售中份额提升。与出货端趋势相似，二线厂商在零售中的份额也有所提升。海信系在2023年全年线上零售额份额提升0.8个百分点，达到4.5%；线下零售额份额提升1.1个百分点，达到10.0%。综合情况总结。2023年空调内销出货量达到历史新高，海信在内销竞争中的份额持续提升。零售方面，空调全渠道零售量同比增长，二线厂商在零售中的份额也有所提升。2024年以来，零售端景气度延续。,2022-2023年格力营销投入,0
家电需求与房地产市场健康状况的关系。根据数据，超过50%的家电需求与房地产市场的健康状况有关。这意味着当房地产市场状况良好时，家电需求也会增加。这是因为购买房屋通常需要购买家电，例如空调、冰箱和洗衣机等。因此，房地产市场的健康状况对家电行业的发展具有重要影响。美的的销售预测和表现。我们预测美的在第二季度的总体销售额将同比增长9.4%。具体来说，暖通空调预计增长8%，冰箱预计增长10%，洗衣机预计增长-1%，小家电预计增长3%。这些预测表明美的在不同产品领域都有不错的表现，尤其是暖通空调和冰箱。美的的出货量改善。根据数据，美的的出货量在第二季度有了显著的改善，同比增长16%。这是基于一个较低的基数，但仍然显示出美的在市场上的竞争力和增长潜力。这种出货量的改善可能与市场需求的增加和公司自身的销售策略有关。美的的平均售价增长较少。尽管美的的出货量有所改善，但今年的平均售价增长较少。这可能是由于市场竞争激烈和价格压力增加导致的。然而，尽管平均售价增长较少，美的仍然通过增加销量来实现销售额的增长。美的的盈利预测。我们预计美的的盈利将在第二季度同比增长16%。这表明公司在销售和成本控制方面取得了良好的表现。然而，需要注意的是，市场的不确定性和竞争压力可能对美的的盈利增长产生影响。格力的出货量改善。根据数据，格力的出货量在第二季度有了改善，同比增长16%。这显示出格力在市场上的竞争力和增长潜力。这种出货量的改善可能与市场需求的增加和公司自身的销售策略有关。格力的盈利预测。我们预计格力的盈利将在第二季度同比增长16%。这表明公司在销售和成本控制方面取得了良好的表现。然而，需要注意的是，市场的不确定性和竞争压力可能对格力的盈利增长产生影响。海尔的出货量改善。根据数据，海尔的出货量在第二季度有了改善。这表明公司在市场上的竞争力和增长潜力。这种出货量的改善可能与市场需求的增加和公司自身的销售策略有关。,2022-2023年格力营销投入,0
安徽地区空调销售情况。安徽地区3月份安装卡数量为8.56万套，同比去年10.2万套有所下降；4月份安装卡数量为9.5万套，同比去年8.8万套有所增长。4月份销售增长主要由于天气变暖和装修活动增加。5月份销售与去年同期持平，但市场整体疲软，存在一定压力。3月和4月提货额同比去年略有下降，但经销商信心有所恢复，开始小规模补货。提货均价同比去年略有增长，经销商对中高端机型补货较多。库存水平接近2个月销售周期，比去年减少约1亿。以旧换新政策。以旧换新政策尚未出台，预计2-3天内公布。格力品牌挂机补贴300元，比其他品牌多100元。政府尚未提供资金支持，补贴主要由格力自己提供。以旧换新政策更多是宣传手段，旨在抢占市场份额。湖北地区空调销售情况。3月和4月安装卡同比去年下降25%至26%，3月份下降约21%，4月份下降约27%。销售下降的原因包括去年疫情解封后的基数效应、今年新房交房量减少以及天气较冷。提货额与去年持平，3月份略少，4月份略多。库存水平约为65天，同比去年略有下降。价格变动和市场结构。提货均价同比去年有小幅上涨，挂机上涨100到150元，柜机上涨1到200元。特价机在提货结构中的比重减少，常规和高端机型比重增加。终端销售均价同比去年也有小幅上涨。其他品牌如海尔和美的也在提高低价位机型的价格，但高价位机型变化不大。以旧换新政策影响。目前以旧换新补贴对消费者的吸引力不大，因为市场上旧空调的价格可能更高。格力的以旧换新政策相比以往更加规范，但消费者可能更倾向于将旧空调卖给二手市场。未来销售和库存预测。5月份销售情况不容乐观，可能与去年持平或略有下滑。完成年度提货目标的可能性较高，但增长有难度，取决于6月和7月的天气情况。中央空调销售下降幅度较大，但通过政策支持，提货量努力达到持平水平，库存消化周期较长。竞争品牌情况。其他品牌如美的、海尔尚未出台以旧换新政策，主要由经销商自己操作。二线品牌如奥克斯在3月和4月份的销售情况可能更差，但在旺季通过低价策略吸引消费者。,2022-2023年格力营销投入,1
医药行业投资观点及展望。尽管市场行情惨淡，医药行业指数跌幅超20%，但对行业仍持超配观点。降价和反腐对行业影响减弱，国内需求加速，出海看到好苗头，预计需求端将有良好表现。医药板块动态。重点关注恒瑞、百济、倍达等股票；医疗器械板块国内竞争力凸显，看好高值耗材赛道和IVD集采相关股票如春丽医疗、安图生物等。医疗设备板块恢复明显，科学流程化采购机制促进恢复。药店行业及政策变动关注。药店行业逻辑良好，重点推荐金域医学；关注独家纪要增速高于非机要的相关公司，以及中药国企改革相关标的，如昆药、康源等。医疗服务板块。受消费端和反腐影响，但长周期看有助于民营医疗竞争力提升，看好固生堂和眼科的华夏普瑞。食品饮料行业短期复苏观点。春节期间备货增速环比明显，但同比受消费复苏力度偏弱影响，整体改善幅度有限。酒类品牌集中趋势：高端白酒品牌如五粮液在千元价格带表现良好；中端酒品牌如汾酒、剑南春集中度增加，体现价格平替现象。估值及投资机会。多数标的估值处于价值底部，股息率提供安全垫，头部白酒公司现金流能力强，市场对报表担忧或带来超跌机会，适宜中期布局。消费品行业投资透视。东鹏饮料需求高增且呈现供需紧平衡状态，春节备货后产能偏紧，短期高增势头有望延续。青啤高端化趋势明显，短期销量压力已反映至估值中，预计高端产品推广将带动旺季销增。伊利股息率高且成长空间大，消费品稳定；重组胶原蛋白市场规模预计大增，产品有抗周期特性，潜在成为医美新蓝海。旅游股点状机会与结构性增长。冰雪旅游成推动因素，大连圣亚与长白山表现突出，客流量及票价超预期，2024年营口项目有望继续贡献增长。结构性分化与投资机会：旅游需求呈现点状的机会，文旅受短视频平台宣传利好，三节索道等不受景区免票影响，盈利能力强。九华旅游预期增长强劲，客流增长主导业绩，交通设施改善将进一步促进客流，且公司估值合理，无泡沫。市场底部家电板块显亮点。家电板块表现较好，估值处于底部区间，有比较高的确定性及红利，耐用品消费信心相对强劲，预期持续跑赢总体消费水平。三大白电公司分析：美的、格力、海尔占据70%-80%市场份额，形成垄断格局。空调从4月到7月零售增长强势，增速在20%-40%波动。公司层面，有能力进行资产注入及渠道调整，释放压力及存量，季度增速持续且有强延续性。空调产能及库存情况：3月份空调排产增速达11%，4月为7.1%，超出预期。前两年存货处于低位，库销比从2.5降至2.04，说明市场库存消化明显。低库存下展望积极，有成长性预期。,2022-2023年格力营销投入,0
"PEG估值方法的隐含假设。PEG估值方法的隐含假设在A股市场有一定依据。大多数行业的高速增长很难持续3年以上，这可能是产业规律导致的，因为高增长会吸引新资本进入并导致供给过剩。大消费行业的增长特点。以大消费行业为例，能够同时满足过去3年净利润年化复合增速大于30%和过去3年单年净利润增速都大于10%的赛道并不多见。除了化妆品、厨电、白酒、空调等行业能在特定阶段实现长期增长，其他行业多数是昙花一现。增速筛选标准达标的赛道数量占比一般在10%以下，并且每次达标的赛道也不同。格力电器的经典案例。格力电器是一个经典案例，该公司在2006-2013年期间经历了高速增长。从2006年开始，公司的净利润同比增速录得141%，开启了从5亿元迈向100亿元的高速成长期。期间公司净利润增速平均维持在40%以上，估值水平也有显著抬升，适用PEG估值方法。格力电器增长的基本面分析。格力电器的高增长受益于行业整体上行。2006-2013年，中国空调销量从3000万台/年上升至接近6000万台/年，年均复合增速约13%。空调作为地产后周期品种，其爆发与住宅销售的增长高度相关。2006-2013年，中国新房住宅销售面积从5.5亿平米上升至9.8亿平米，同样接近翻倍，年化复合增速约10%。叠加居民收入水平提升和空调家庭渗透率的提升，空调行业高速增长。PEG估值方法的有效性。根据PEG估值方法，以当年预期和后验的真实净利润复合增速作为增速G的模拟，展望时间为3年，每年年末作为交易时点，刻画价值线并进行历史表现回测。若以PEG=0.5为买入信号，PEG=1.0为卖出信号，该策略受到增速G的预测质量影响较大。基于Wind一致预期的策略效果。基于Wind一致预期情况下，由于市场预期持续性低于成长期格力的真实业绩，始终没有出现PEG=0.5的买入信号，该估值方法低估了格力电器的内在价值。若将买入信号上调至PEG=1.0,2008年、2011年底分别指示买入，持有1年后收益率分别为+123%-5%。但2008年的买入点是1664点的历史大底附近，且错过了格力2006年开始市值从100亿元上升至500亿元的成长机会。基于真实业绩的策略效果。基于真实业绩，策略有效性显著提升。2006年底行业基本面变化时能准确反映公司内在价值的提升，当时格力电器市值96亿元，而PEG方法预测三年后合理市值290亿元，存在3倍空间。2007年年底上证指数从6124的历史高点回落，估值接近PEG=1.0的高点，指示卖出；而到了2008年底公司股价再次跌破PEG=0.5的合理价，指示买入，精准把握了波段机会。2009年末股价回到PEG=0.72的水平，继续持有；2010-2012年公司市值均低于PEG=0.5的水平，可以加仓或者继续持有；2013年末，公司PEG=0.69格力电器增速预期开始下滑，不再符合PEG估值使用条件。PEG估值方法的收益和市值增长。即便以一年交易一次的低换手率，严格按照PEG估值方法操作，在2006年底到2013计涨幅也有接近17倍，7年复合年化收益率50.4%。同期格力电器市值从2006年底的96亿元上涨至2013年底的982亿元，接近10倍。可见PEG估值方法不仅可以抓住成长股的机会，波段操作也能放大收益。",2022-2023年格力营销投入,0
