content,query,score
公司优势。该公司在CMOS图像传感器方面拥有显著优势，已在多个领域取得成功，包括车载摄像头、医疗、无人机、安防监控和AR/VR等。这些优势有助于公司在未来进一步扩大市场份额和提供更好的服务。生产流程。该公司仅从事芯片研发设计，晶圆制造和封装测试采用外协加工的形式，并选择国际知名、中国行业领先、上市公司为主的代工企业。这样做有助于公司专注于研发设计，同时保证了产品质量和生产效率。客户认证。该公司已通过200多家客户的认证，包括联想集团、小米、酷派、步步高、海信、金立、TCL、中兴通讯、长虹、海尔等。这些客户的认可证明了该公司在产品质量、服务和市场影响力等方面的优秀表现。半导体生产商。该公司代理及销售的半导体生产商包括光宝、乾坤、南亚、国巨、松下、Molex、AVX、三星等，产品质量可靠、种类丰富、货源充足稳定。这些半导体生产商的产品涵盖了消费电子、家电、汽车、计算机等领域的主要产品类别，可以满足细分行业客户的需求。全球智能手机市场。2016年全球智能手机总出货量为14.706亿部，市场份额前五名依次为三星、苹果、华为、OPPO、VIVO，其中华为、OPPO、VIVO为中国品牌。作为一个半导体芯片设计企业，该公司可以从智能手机市场中获得更多机会，并在其他领域中寻找新的市场机会。未来发展。该公司将立足于半导体设计行业，以移动通信、数码产品为发展根基，积极拓展产品在安防、网通、智能家居、可穿戴设备等领域的应用。这样做有助于公司在未来进一步扩大市场份额和提供更好的服务。公司愿景。该公司希望成为代表行业领先水平、具有重大影响力的高成长、自主创新的高新技术企业。这个愿景体现了公司对未来的期望和努力方向。知识产权。头豹拥有相关知识产权，已获得发布方的授权，如有侵权行为，头豹将代表发布方进行维权。这个保护措施有助于确保公司的知识产权得到充分保护，同时为公司未来发展提供更好的保障。,华为出货量,1
"锐捷在国内市场的地位和布局。锐捷在国内市场中扮演着重要的角色，与新华三和华为一起主导了国内市场。根据IDC的数据，2022年，新华三、华为和锐捷（CR3）在中国企业级WLAN市场的份额达到76%，其中锐捷的市占率为22%。锐捷在服务行业、教育和通信行业的WLAN市场中排名第一。锐捷的无线产品布局。锐捷目前的主力无线产品是Wi-Fi6无线AP，包括放装型、墙面型、室外无线接入点和小锐A等多个系列。这些产品适用于高教、政府、普教、金融等多个部署场景。根据IDC的数据，2019年至2022年，锐捷连续四年在国内Wi-Fi6产品出货量方面排名第一。此外，锐捷于2023年6月推出了放装型无线接入点系列的Wi-Fi7产品，其无线接入速率最大可达16.46Gps，性能较Wi-Fi6系列有大幅提升。锐捷在路由器市场的布局。在国内路由器市场中，华为稳居第一的位置，而锐捷主要布局在企业级路由器产品上。根据锐捷网络的数据，2022年中国路由器市场规模达到38.6亿美元，预计到2026年将达到49.5亿美元，复合年增长率约为5%。国内的路由器厂商包括华为、新华三、中兴和锐捷等，华为在整体市场份额方面处于绝对领先地位，而华为和新华三在企业路由市场上占据优势。锐捷网络在企业级路由器领域布局了多款产品，覆盖核心、汇聚和接入等多个场景，主要应用于政府、金融和教育等行业的网络关键节点。中国网络安全市场的增长和竞争格局。中国的网络安全市场增速高于全球平均水平，竞争格局较为分散。根据IDC的数据，2022年全球网络安全总投资规模为1,955.1亿美元，预计到2026年将增至2,979.1亿美元，复合年增长率为11%。其中，中国网络安全市场支出规模预计将达到288.6亿美元，同期复合增长率超过20%，增速高于全球平均水平。根据中国网络安全产业联盟的数据，2021年中国网络安全市场的CR3和CR5分别为22.6%和32.6%。目前，中国的网络安全供应商主要可以分为两类，一类是专业安全厂商，主要为政企、金融和医疗等对安全要求较高的企业单位提供服务，代表厂商为奇安信等；另一类是网络设备厂商，其主营产品为网络设备，同时具备设备和网络安全产品研发能力，捕捉长尾市场中中小型企业的网络安全需求，代表厂商有锐捷网络和新华三等。锐捷网络的整网安全布局。随着信息安全问题日益复杂，单个设备往往难以全面检测安全威胁，新一代安全设备需要与交换机、无线产品等网络设备进行协同防护，整网体系化安全成为网络安全发展的重要方向。相比传统的专业安全厂商，锐捷网络基于整网安全视角，打造了网络+安全防护体系，具备两点优势：1）安全事。锐捷网络的竞争优势。锐捷网络在国内市场中具有竞争优势。在企业级WLAN市场中，锐捷在多个应用场景中排名第一。此外，锐捷在无线产品方面也取得了成功，其Wi-Fi6产品连续四年在国内出货量方面排名第一。在路由器市场中，锐捷在企业级路由器领域布局了多款产品，满足了政府、金融和教育等行业的网络需求。同时，锐捷网络也在网络安全领域有一定的布局，打造了整网安全防护体系。中国网络安全市场的发展机遇。中国的网络安全市场增速高于全球平均水平，预计未来几年将继续保持较高的增长率。锐捷网络作为网络安全领域的布局者，有望受益于整网安全的发展机遇。整网安全的趋势将推动网络设备与安全设备的协同发展，为锐捷提供了发展的机会。",华为出货量,0
华为液冷装备预计明年出货量最少为20方个，价格在一块钱左石。主要客户群体包括国字头的三桶油再加两个电网、新兴的充电运营公司、传统的充电运营公司以及主机厂车企。华为液冷装备的技术优势。华为液冷装备的技术优势表现在寿命更长、效率更高、智能功率分配算法等方面，可以支撑比其他品牌更高的价格，并能够给运营商带来额列的收益。本次专家会议讨论的省钱优势。本次专家会议讨论了液冷装备在线缆施工建设、变压器配备，apfsvg配置等方面的省钱优势。下游客户分析。下游客户分为巨头、新兴干充电运营、创业运营和主机厂等几类，其中巨头占比6成左右。,华为出货量,2
"华为推出业界首款柔性OLED平板。华为在秋季新品发布会中宣布推出业界首款柔性OLED屏平板MatePad Pro13.2，定价5,199元起，面向中高端平板市场。该平板具有屏幕尺寸更大但机身厚度更薄、重量更轻的优势，且屏幕刷新率更高。与竞品对比，MatePad Pro13.2具有明显的优势。柔性OLED的优势。相较于传统的刚性OLED，柔性OLED采用柔性可弯曲基底材料，搭配特殊的薄膜贴合封装，产品具备更好的柔韧性与轻薄性。柔性OLED设计自由度更高，可为卷产曲品设计提供更大的自由度；更轻薄和轻便，柔性OLED的柔性基底和薄膜结构使得整个显示器件更薄，在轻便性和可携带性方面具有优势；视角更宽广，柔性OLED屏幕在不同观看角度下仍能保持较高的图像质量和颜色准确性；能耗较低，柔性OLED以像素级为单位进行亮度控制，只有需要显示的像素才会发光，而其他像素则可完全关闭，便于器件降低功耗，也使得电池寿命得到延长。华为MatePad Pro13.2的升级和改进。与上一代产品对比，华为MatePad Pro13.2在屏幕尺寸、轻薄度、操作系统等方面有所提升，同时屏幕类型从传统OLED改进为柔性OLED，为业界首款搭载OLED材质的平板电脑。在外置配套方面，HUAWEI M-Pencil升级至第三代并采用星闪技术，在实现稳定连接、超低时延的同时，书写压感从4096级提升至超万级，用户书写体验有较大提升。OLED制造成本和Mini LED。OLED制造成本随着屏幕尺寸增长而增大，平板电脑尺寸OLED的成本较Mini LED更低。根据Omdia的测算，以12.9英寸的平板电脑和16.2英寸的笔记本电脑作为样本，随着尺寸增长，OLED面板生产成本涨幅明显，16.2英寸OLED面板的制造成本高于12.9英寸，而Mini LED的生产成本则变化较小。这是由于模组材料占据Mini LED生产成本的较大部分，屏幕尺寸对其生产成本的影响相对较小，因而随着生产屏幕尺寸的增长，OLED与Mini LED的生产成本差距逐渐缩小；在平板电脑尺寸区间，OLED成本较Mini LED更低，而到笔记本电脑尺寸区间，OLED成本与Mini LED已经较为接近。OLED面板在平板电脑领域的需求。OLED面板在平板电脑领域出货增长较快。根据Omdia预测，2022年到2030年OLED显示面板的需求面积复合年增长率达到11%，其中移动电脑领域的复合增长率最高，达34%，高于OLED电视（10%）及智能手机领域（5%）。从具体数据看，OLED显示面板出货片数在笔记本电脑、平板电脑及显示器领域增长较快，其中笔记本电脑出货量在2022年为5.5百万片，同比增长8.8%，预测2023年出货7.5百万片，同比增长达36.3%；平板电脑方面，2022年出货4百万片，同比增长34.8%，预测2023年出货6百万片，同比增长达51.3%。消费电子需求复苏不及预期。消费电子需求复苏不及预期。虽然OLED面板在笔记本电脑、平板电脑及显示器领域出货量增长较快，但消费电子市场需求的复苏不及预期。受到新冠疫情的影响，全球消费电子市场面临着前所未有的挑战，市场竞争也加剧，面板价格复苏不及预期等因素限制了OLED面板的推广和发展。OLED面板的前景。总体来看，OLED面板在未来仍然有着广阔的发展前景。随着柔性OLED技术的发展和成熟，OLED显示器件在可穿戴设备、卷曲屏幕等新领域具有广泛的应用前景，而在平板电脑、笔记本电脑等领域，OLED面板也有望逐渐取代传统的LCD面板。未来，随着OLED面板生产成本的进一步降低和技术的不断进步，OLED面板将更加广泛地应用于各个领域。",华为出货量,0
公司产品FPR表现和毛利率改善展望。公司预计在下半年，产品FPR的出货表现将有所改善，这将有助于提高公司的毛利率。FTTR产品市场需求和业务展望。FTTR产品是固网终端产品中的亮点，去年市场出货量接近1200万台，主要由华为和中兴供应。预计今年市场出货量将接近2000万台，占中国市场约20%。FTTR产品均价较高，预计未来几年将保持每年20%的增长，有望达到3000万台以上。FTTR产品在中国成熟后，预计将向海外市场扩展，尤其是在亚太地区。此外，FTTR在企业市场也有重要应用，预计这部分市场将有很大的发展机会。数通业务展望和400G、800G产品营收预期。数通产品是公司重点发展的新产品线，预计2024年将有显著增长，尤其是在中高端交换机和核心路由领域。营收增长的核算标准将按照实际交易金额进行，但需注意财务准则可能对销售额的核算有所影响。例如，客户指定渠道购买的物料可能不计入销售额。公司内部计价的营收约为90亿，但财务核算可能只认可80多亿，主要由于部分营收被减掉。海外客户对100G以上交换机的需求情况。公司确实有100G以上的交换机产品，并且正在积极发展白盒交换机市场，希望在未来几年取得较好的成果。文远收购的价值评估和未来业绩预期。公司认为文远仍然是一个有价值的公司，尽管前两年的商誉减值是基于财务审慎性原则，考虑到文远业绩下滑和5G进展放缓等因素。公司希望在计提商誉后能够轻装上阵，并对文远未来的发展和业绩提升持乐观态度。公司已经将文远公司与内部基站公司的管理团队进行了整合，以强化业绩提升和产品研发能力。目前没有出售文远的计划。费用率水平和改善措施。公司将从财务费用角度出发，采取措施降低费用。由于目前美元贷款利率较高，公司计划在今年上半年将美元贷款全部归还，转为人民币贷款，预计可以节省数千万的财务费用。同时，公司也在精简库存和加大销售回款周期，以降低财务费用。此外，公司还在严格控制销售费用和管理费用。汽车电子产品出货情况和车载官网开拓计划。去年汽车电子出货量最大的是射频类产品，而非激光雷达。今年，激光雷达的出货量预计将大幅攀升。关于车载官网的开拓计划，公司没有提供详细信息。,华为出货量,0
华为与长安合资公司成立，加速智能化发展。华为与长安合资公司成立，这是24年整车主线之一。此合作是车企技术差距提供合作需求的结果。我们预计华为还将与一汽等车企合作，进一步扩大合作范围。智驾技术和智能座舱是合作的重点。合作折射出24年市场智能化加速趋势，智驾技术和智能座舱是车企与华为系合作的重点。车企通过推出智驾车型、发布智驾路线图以及配备L3级硬件冗余来抢占消费者智驾认知。锂盐和负极石墨化价格波动不大，需求较弱。锂盐价格本周涨跌互现，部分涨价源自环保督察消息提振的商家筑底情绪，而部分下跌则是持货商的让利去库和采购商按需议价。负极石墨化价格本周持平，市场比较清淡，部分企业的生产计划也延迟到三月。电解液市场复工较慢，价格稳定。电解液市场需求偏弱，春节后初步复工，各家电解液厂开始恢复生产，但整体开工率及出货量均处于低位。价格方面，由于原料价格稳定，本周电解液价格平稳，没有明显变化。MB钻价格稳定。本周MB钻价格仍旧处在弱稳区间，市场资源量预期相对宽松，影响场内议价重心。主要消费领域仍在恢复阶段，3C行业年内需求活跃度有限。天然石墨负极价格持平。本周天然石墨负极价格持平，市场比较清淡。一月份很多负极企业提前备库，二月份出货量多以消化库存为主，生产节奏放缓，部分企业恢复生产的计划延迟到三月。六氟磷酸锂和电池级电解液价格持平。本周六氟磷酸锂和电池级电解液价格持平。电解液市场复工较慢，各家电解液厂积极联络客户，工厂开始恢复生产，但整体开工率及出货量均处于低位。合作落地意料之中。华为与长安合资公司成立的合作落地意料之中。我们认为华为系朋友圈扩容是必然的，后续可能会与一汽等车企合作。24年是华为系全面扩容之年，与BBA定位接近的华为有高增长性和高爆发性。,华为出货量,0
宇环数控公司及其全资子公司宇环精研。宇环数控是一家专注于半导体加工设备的公司。然而，该公司的CMP设备国产化率不足15%，存在进口替代的空间。为了推动新业务开展，公司成立了全资子公司宇环精研，专注于开发半导体加工相关设备。CMP市场的现状和趋势。CMP市场主要分为设备和耗材两部分，其中CMP耗材占据近68%的市场份额，而CMP设备占32%。根据统计数据，2021年中国大陆地区的CMP设备市场规模为6.8亿美元，同比增长58%。然而，大部分高端CMP设备仍然依赖进口，据统计，2021年中国CMP设备的进口金额为5.91亿美元，国产化率不足15%。3C业务的发展前景。3C业务是宇环数控的重要业务领域，有望受益于钛合金化和VisionPro量。手机厂商如苹果、小米和三星相继推出钛合金手机，消费电子行业可能进入钛合金时代。此外，折叠屏手机市场也呈现快速增长，预计2024年全球折叠屏手机的年出货量将超过3000万部。华为的Mate60系列手机供不应求，预计2024年华为的出货量将达到6000万至7000万部。钛合金手机加工的挑战和优化。钛合金手机加工具有一定的挑战性。钛合金手机中框的整体良率约为30%-40%，远低于铝合金中框的80%。此外，钛合金加工时间长，约为铝合金的3-4倍。然而，钛合金具有比强度高、耐热性好、抗蚀性强等优良特性。磁力研磨技术具有自适应性强、自锐性高、温升低及无须工具补偿等优点，适用于加工钛合金的平面、曲面以及复杂形状的工件。折叠屏手机市场的增长趋势。折叠屏手机市场呈现快速增长的趋势。根据最新数据，2023年第二季度中国折叠屏手机市场出货量约为126万台，同比增长173.0%。上半年的出货总计达到227万台，同比增长102.0%。根据预测，2024年全球折叠屏手机的年出货量将超过3000万部，复合年增长率为53%。华为Mate60系列手机的供需状况。华为的Mate60系列手机供不应求，市场需求旺盛。据报道，华为计划将自家智能手机2024年的出货量提高一倍，达到6000万至7000万部。Mate60系列手机的热卖使得华为能够在智能手机市场取得更大的份额。钛合金手机加工的优化技术。钛合金手机加工可以通过磁力研磨技术进行优化。磁力研磨后，钛合金的轮廓可以去除原始的铣削加工纹理和刀具切削形成的沟壑，使工件表面获得较小的粗糙度和细密的加工纹理。这种技术可以提高钛合金加工的效率和表面质量。手机3D玻璃盖板的生产加工工艺。手机3D玻璃盖板的生产加工工艺包括多个步骤，如开料开孔、精雕、清洗、热弯、抛光、检测、钢化、UV转印、镀膜、印刷、贴膜和包装等。这些步骤需要经过精细的加工和质量检测，以确保手机3D玻璃盖板的质量和性能。,华为出货量,1
发改委要求的国产算力服务器与海外服务器比例。发改委要求的国产算力服务器与海外服务器1:1的比例将决定出货量。各公司的执行情况将影响最终结果。运营商至少会采购1.5万至1.7万台服务器，这是底线。中国移动已下单8600台，显示采购力度已开始。算力产业链的全链条机遇。服务器市场目前分散，主要供应商是华为和海光。华为在运营商领域较强，海光在金融行业较强。紫光股份也在大量使用910B芯片制造服务器，其他公司如浪潮、曙光和兴旺瑞杰也在使用。超聚变等公司也提供产品，市场竞争激烈。交换机市场相对集中，紫光股份和菲尼克斯等公司占据市场份额。华为芯片在大规模集群中的性能。华为的芯片在大规模集群中性能相对较弱。在单卡性能或小规模卡的情况下表现出色，但在大规模集群中发热量大，性能下降。对液冷的需求特别高。根据国家发改委的要求，新建数据中心的PUE指标应低于1.1，改造的应低于1.2，传统数据中心的PUE指标为1.3。液冷使用比例可能超过80%。产业链中的液冷机会。液冷在产业链中有很大机会。因为他们使用的是英伟达的卡，发热量可接受。液冷的使用比例肯定会超过50%。液冷技术在大规模集群中的需求将大幅提高。政策采购和开发支持。政策采购和开发支持是算力市场的情况之一。运营商的采购力度已经开始，市场可能面临主设备商的交货压力。运营商相关的产业链存在确定性的机遇，将带来订单、收入、利润增长和估值提升。服务器供应商的分散。服务器市场目前分散，华为和海光是主要供应商。华为市场份额高，将向各行各业交付产品。紫光股份等公司也在使用910B芯片制造服务器，市场竞争激烈。交换机市场的集中。交换机市场相对集中，紫光股份和菲尼克斯等公司占据市场份额。菲尼克斯的市场份额最高，是推荐的重点公司。建议密切关注算力市场发展。今年算力市场具有高弹性，建议密切关注其发展。运营商至少会采购1.5万至1.7万台服务器，华为和海光是市场的主要供应商。液冷技术在大规模集群中的需求将大幅提高，使用比例可能超过80%。液冷在产业链中也有很大机会。,华为出货量,0
CIS行业竞争格局。从CIS行业竞争格局来看，行业集中度较高，索尼、三星、豪威为龙头厂商。根据Counterpoint数据，按销售额口径，索尼作为全球CIS产业龙头，2022年市场份额达到39.1%。三星和豪威分别占据24.9%、12.9%的市场份额，前三名占据73%的市场份额。细分市场表现。细分市场来看，索尼的产品线布局较为完善，覆盖智能手机、汽车、安防、工业等领域，三星凭借在智能手机市场的地位和品牌知名度，在智能手机市场占据较高的市场份额。豪威在智能手机、汽车、安防领域布局较早，并占据一定市场份额，韩国的SK海力士和国内的格科微凭借在低像素领域中的优势也占据一定市场份额，安森美深耕汽车电子领域，思特威是安防领域龙头厂商。聚焦手机市场。光学仍是创新主赛道，手机品牌厂商视摄像头为关键卖点，提升使用体验。手机CIS市场规模趋于稳定，近年的降规或接近尾声。随着手机终端进入存量市场，差异化变得日益重要。2023年下半年，手机需求温和复苏，CIS行业去库存接近尾声，同时国产厂商的新产品突破持续超预期，市场格局正在快速变化。国产新机行情。国产新机行情旺盛，国内产业链有望受益。华为的Mate60系列手机的发售带动华为手机增速明显，mate60系列手机的销售热潮有望带动各系列机型销量向上。华为系列机型按照价格带从高到低依次为Mate系列、nova系列、P系列和畅享系列。畅享系列和nova系列的出货量占比最大，合计近70%。此外，小米和红米品牌的新机销售也表现强劲。趋势：摄像头配置和像素。后置摄像头数量提升基本陷入停滞，厂商将摄像头视作提升用户体验的关键卖点。中低端机型中，双摄和三摄方案占主导地位，高像素占比持续提升，低像素市场经历下滑后基本企稳。2022年以来，中低端机型的性价比竞争激烈，厂商为降低成本减少摄像头数量，四摄方案渗透率下降，三摄和双摄方案渗透率提升。目前单部手机平均搭载摄像头颗数下降空间较小，市场出货量已基本稳定。市场前景和变化。国产厂商在手机市场表现强劲，新产品带来的增长超预期。随着手机需求的温和复苏和CIS行业去库存接近尾声，我们预计2024年将看到相关企业业绩的快速增长。市场格局正在快速变化，国内产业链有望受益。行业竞争格局和龙头厂商。CIS行业竞争格局高度集中，索尼、三星和豪威是龙头厂商。根据Counterpoint数据，索尼是全球CIS产业的龙头，2022年市场份额达到39.1%。三星和豪威分别占据24.9%和12.9%的市场份额，前三名占据73%的市场份额。此外，韩国的SK海力士和国内的格科微在低像素领域中占据一定市场份额，安森美在汽车电子领域深耕，思特威是安防领域的龙头厂商。市场趋势和创新驱动。创新主要集中在光学方面，厂商将摄像头视作提升用户体验的关键卖点。随着手机终端进入存量市场，差异化变得日益重要。双摄和三摄方案占主导地位，高像素占比持续提升，低像素市场经历下滑后基本企稳。市场格局正在快速变化，厂商需要不断创新以保持竞争力。,华为出货量,1
