content,query,score
淘工厂的规模和指标。淘工厂预计在2023年的销售规模约为160亿，订单价为33.7元，销售件数为13.76亿。这些指标相对于前几年有所放缓，但整体仍保持增长趋势。a1000计划和商业化扶持。淘工厂通过a1000计划和其他商业化扶持措施，帮助工厂和商家增长销量和利润。a1000计划每个月扶持1000个工厂，面向淘工厂内部的二级类目和Top级店铺。此外，还提供免费开店、买家快速打爆、佣金抽佣和商业化广告等权益。淘工厂的商业模式。淘工厂的商业模式是C2M，即工厂直供消费者。它通过供应链和数字技术，将制造业的红利分享给消费者。淘工厂聚焦下沉市场，提供低价、品质保证和性价比高的商品。淘工厂的合作模式。淘工厂的合作模式丰富多样。商家可以通过淘工厂售卖商品，也可以渗透到其他场景，如淘宝好价和拼多多回归商户等。合作商家数量达到41万，合作模式不断丰富。淘工厂的物流和履约。淘工厂负责履约部分，菜鸟和丹鸟负责物流。商家享受一定的运费补贴，菜鸟的利润的一半补贴给商户。物流方面，菜鸟和丹鸟提供包装、发货等服务，确保履约速度和商品质量。淘工厂的用户类型。淘工厂的用户类型多样。约60%的用户关注潮流和品牌化时尚款式，50%以上的用户喜欢大众商品并追求品质，约40%的用户注重低价商品但会进行比价。淘工厂与直播达人合作。淘工厂与直播达人合作，提升营销能力和推广效果。通过与直播达人对接，进行直播推广，帮助工厂和商家快速增长销量。淘工厂的目标和优势。淘工厂的目标是将制造业的红利分享给消费者，实现供应链优势和数字技术的结合。通过C2M商业模式，淘工厂将工厂直供消费者，减少中间环节，提供低价、品质好的商品。同时，淘工厂通过与直播达人合作，提升营销能力和推广效果。,淘宝 退货包运费,0
线上运营。瑞达的线上运营主要通过名师的影响力进行，没有专门做推广。主要在微博和微信上进行运营，没有在其他平台进行宣传。主要通过名师的影响力来吸引学员，而非广告投放。学习包和正价课程销量。瑞达没有统计学习包的销量，但是通过学习包可能有小几千人购买正价课程。学习包不仅有学习包本身，还有单个老师的课程。瑞达的客户主要通过学习包购买正价课程。官网和淘宝店铺。瑞达的线索追踪和销售转化主要通过官网和淘宝店铺进行。官网和淘宝店铺是瑞达的主要销售渠道，能够帮助瑞达进行线索追踪和销售转化。存活方式。瑞达的存活方式主要靠名师和相关的投放运营广告。瑞达没有投放过广告，但是通过名师的影响力和相关的投放运营广告来吸引学员。瑞达的存活方式是靠名师和相关的投放运营广告。线下加盟。瑞达自己直属的面授课只有在北上广深这种大城市，其他的都是加盟。加盟商既有自己的教授讲课，也可以销售加盟课程。线下加盟是瑞达的一种销售方式。公开课。瑞达线下有公开课，可以转化为销售。公开课是瑞达的一种销售方式，可以吸引潜在客户参加公开课，从而转化为销售。社群运营。瑞达没有专门设立社群，但是可能会在微博上设立一个超话。瑞达没有专门设立社群，但是可能会在微博上设立一个超话来增加流量。广告投放。瑞达没有专门做广告投放，所有的学员都是奔着名师来的。瑞达没有专门做广告投放，主要靠名师的影响力来吸引学员。,淘宝 退货包运费,0
023年汽车行业发展现状。2023年，国内汽车市场迎来了产销量的历史性突破，其中新能源汽车表现尤为出色，渗透率成功突破30%的重要关口。汽车行业的迅猛发展带动了相关服务领域需求的强劲增长，汽车服务行业流量连续12个月保持同比正增长，其中有7个月的增长幅度超过两位数全年平均增长率达8.6%。汽车市场的繁荣为汽车服务行业注入了新活力。023年在线旅游行业动态。在线旅游行业在2023年全年流量爆发式增长，其中4月同比增长率达74.6%，达到全年峰值。流量增长与节假日、寒暑假等相关，用户在节假日前更倾向于进行旅游活动的规划。18-24岁的年轻用户是在线旅游行业的主要用户群体，新一线和二三线城市的用户也是行业流量的主要贡献者。023年网上招聘行业动态。2023年网上招聘行业移动端流量大幅增长46.7%，主要来源于男性、已婚、成熟年龄段的用户。男性和女性用户的流量增幅均超过四成，其中男性用户的增长更为显著。已婚群体的流量增幅超过五成，40岁以上用户的占比提升了3.2%。二线城市用户的占比有所下降，而四五线城市用户的流量占比有所提升。023年学习教育行业动态。2023年学习教育行业中，儿童教育和K12教育受到政策的影响，流量和用户使用时长出现下滑。儿童教育的流量相对稳定，而K12教育的用户规模同比缩减了11.4%，用户平均使用时长减少了18.2%。专业学习和语言教育两个细分行业则呈现出强劲的增长势头，显示出这两个领域仍然具有巨大的发展潜力和市场空间。023年在线视频行业动态。2023年在线视频行业的流量增长主要受到优质剧集的驱动，这促进了平台口碑和收益的双提升。平台流量和用户使用行为的变化趋势主要由头部APP引领。023年淘宝&拼多多&京东设备数。2023年12月，淘宝、拼多多和京东的去重设备数达到108499.8万台。其中，淘宝和拼多多共同设备数为27959.7万台，淘宝和京东共同设备数为23543.5万台，拼多多和京东共同设备数为13282.8万台。023年汽车服务行业概览。2023年国内汽车产销量创下历史新高，汽车消费市场的繁荣激发了相关需求的强劲增长，汽车服务行业的流量显著提升。这一行业连续12个月保持同比正增长，其中有7个月的增长幅度超过两位数。汽车市场的繁荣为汽车服务行业注入了新的活力。023年学习教育行业用户画像。在学习教育行业中，专业学习和语言教育两个细分领域的用户群体呈现出显著增长。尤其是24岁以下的年轻用户在专业学习和语言教育领域的占比相较于其他细分领域有显著提升。这两个领域的用户主要集中在高线城市，二线及以上城市的用户比例相较于儿童教育和K12教育行业更高。年轻且来自较高经济发展水平地区的用户构成了这两个领域的核心受众群体。,淘宝 退货包运费,0
电商平台业绩预期。预计今年618期间，抖音和拼多多的整体增长率将达到两位数，甚至可能超过20%至30%。这两个平台在过去几年中取得了显著的增长，吸引了大量的年轻用户和中低收入群体。他们通过短视频和社交电商的模式，成功吸引了用户的注意力并推动了销售额的增长。因此，他们在今年618期间的表现也将相对较好。淘宝的增长前景。淘宝的增长前景相对较为困难，预计增长率可能只有个位数，甚至可能出现负增长。淘宝作为中国最大的电商平台之一，面临着市场饱和和竞争加剧的挑战。同时，淘宝的内容也缺乏吸引力，导致用户流失。此外，淘宝的头部直播达人数量减少，可能导致流量向其他平台迁移。因此，淘宝在今年618期间的增长前景相对较为困难。京东的增长预期。京东的增长预期相对乐观，预计能达到10%的增长率，但可能不会达到特别高的两位数增长。京东凭借其高净值用户群体和快速的服务，成功地保持了一定的市场份额。尽管面临着抖音和拼多多等平台的竞争，但京东在品质和服务方面的优势仍然存在。因此，预计京东在今年618期间的增长表现相对乐观。天猫等平台取消预售机制的反应。天猫等平台取消预售机制是消费者用脚投票的结果。之前的促销活动过于复杂，消费者感到疲惫，希望能以最简单的方式购买到全年最低价的商品。此外，平台内部也倾向于简化流程以满足创新和报告的需要。取消预售后，消费者的购买行为将变得更加直接和简单，不再需要熬夜等待或计算复杂的优惠活动。然而，这也可能导致购买紧迫性的降低，消费者可能会怀疑618之后是否还有更低的价格。取消预售对消费者购买行为的影响。取消预售后，消费者的购买行为将变得更加直接和简单。他们不再需要熬夜等待或计算复杂的优惠活动，可以更轻松地在活动期间购买商品。这可能会减少消费者的购买紧迫性，因为他们可能会怀疑618之后是否还有更低的价格。对于某些品类，如美妆，消费者可能仍然会在618期间寻找囤货的机会，尤其是对于国际大牌。然而，对于其他品类，如家居生活用品，消费者可能不会特别关注618的购买节点，因为其他平台如拼多多也能提供廉价商品。取消预售和战线拉长对退货率的影响。取消预售和战线拉长可能会导致退货率的增加。消费者可能会因为购买过程的便捷性而购买更多商品，然后选择退掉不满意的部分。特别是年轻消费者，他们更倾向于先购买再决定是否保留。此外，平台推出的优惠政策，如88VIP、京东Plus等，以及无限退货的运费险，也可能鼓励消费者购买后退货。但对于美妆产品，由于拆封后不能退货，退货率可能相对较低。对于服装等其他品类，退货率可能会空前增加。尽管如此，快递公司可能会因为退货带来的双向物流而受益。预售规则变化对备货和库存的压力。预售规则的变化对不同行业的影响不同。对于美妆行业而言，由于产品体积小、无需冷藏、运输重量轻、占用仓库空间少、生产成本低，且通常有三年保质期，因此备货压力相对较小。此外，美妆行业的数据化建设较好，能够更好地预测需求并进行备货。然而，对于其他行业，如服装和家居生活用品，预售规则的变化可能会对备货和库存造成一定的压力。特别是在战线拉长的情况下，商家需要更准确地预测需求，并保持适当的库存水平。,淘宝 退货包运费,1
男性及50岁以上用户群具有挖掘潜力。未来男性及50岁以上用户群是具有挖掘潜力的美妆消费群体。高端美妆产品购买年龄呈上升趋势，30-35岁购买力最强。抖音上的美妆达人带货趋势。抖音将减少头部美妆达人流量，推广商家自运营，降低达人带货所占比重，扶持多个小达人分散效率高于单个大达人。粉丝量与销量关系解析。美妆品牌在抖音的粉丝数量与销量并非完全正相关，品牌账号较个人账号吸粉难度更大。品牌在抖音上的运营时间越长，增粉速度减缓，三个月为建设期，一年后转为稳定期。珀莱雅维持高粉丝量与销量得益于抖音的扶持、质量高的商品及其在抖音的积极运营。抖音美妆品牌竞争态势分析。爱尔博士产品性价比高，抖音价格优惠，但预算有限。怡联品牌在抖音上热度不高，缺乏更多机构运营和营销，导致品牌火热程度不足。完美日记和炼火在抖音热度高，销量较好。完美日记与炼火的月产值分别在七八千万左右，具有强大的宣传和运营背景。抖音三八好物节的扶持力度增加。今年的抖音三八好物节扶持力度显著加大，现金补贴从去年的15亿增加到22亿，总体资源补贴达到140亿到150亿。入驻门槛提高，新增运费险要求，官方提供额外权益，如立减标签、专区优惠、以及包邮补贴。此外，特别推广偏远地区配送，来支持下沉市场。销售目标也更高，预计成交额将达到600亿左右，要求商家提高单量，并提供相关补贴激励，官方给用户的补贴可以叠加使用。抖音美妆GMV和广告目标规划。抖音平台对2023年的GMV设置目标最低为3.5万亿，预期可达4万亿，并在不断引进新商家。美妆行业呈现上升趋势，预计2023年抖音美妆的GMV约为2885亿，Q4季度单独约为835到836亿。2024年，美妆行业的目标预计为3700亿。在广告方面，字节跳动整体广告收入预计为433亿，其中巨量引擎部分约340亿，而2024年美妆行业的广告目标设为400到425亿，其广告目标增幅对比GMV有所下降。抖音美妆市场份额与市场规模变化趋势。目前抖音在线上美妆领域的市场份额至少大约在15%左右。相比天猫，如果仅考虑天猫的数据，抖音的规模大约是天猫的1/3.4。如果将淘宝和天猫合并考虑，那么抖音的市场份额与淘系相比则至少低七八倍。抖音对品牌方的大量扶持使其在国内美妆市场广告份额较高，与整个阿里相比，字节系的美妆行业广告投入已经超过了淘宝。抖音电商广告增速与市场规模变化。抖音电商的广告增速没有追上电商自身的增长速度。据预测，2022年电商行业的广告市场规模大约是1100亿左右，而预计到2023年，算上家居用品，广告市场规模会增长到1420亿，到2024年，则可能达到1800亿。,淘宝 退货包运费,0
南美市场的分散性和相对落后性。南美市场太分散，且相对落后，可能下一个热点会在中南美。巴西的智能表换装情况。巴西不太可能大规模换装智能表，因为国家经济水平和电力公司投资水平决定了这不太可能。巴西90%的产品都是普通电子表，不是智能表。如果巴西电力公司的管理水平跟不上去，投资智能表就没有意义。而且巴西人口资源丰富，淘宝对他们来说不是一个成本问题。南美市场的智能表投资机会。阿根廷和智力的经济条件比巴西还要差，所以智能表的更换或者状况更差。智力一直想放这个资产表，但电网监管资产被卖给了中国人，很多电网资产在外资手上，这些外资对智能表的治理并没有特别大的兴趣。B组的市场主要是电子表为主，而且量也很小。南美市场太分散，可能下一个热点会在中南美。非洲市场的机会。非洲市场有大量机会，大多数大型项目都来自于四行的资金招标，招标透明，执行迅速。判断表计行业需求持续性的方法。观察电网建设、基础设施建设等前置性指标，电表是收钱的计量工具，必须通过电表这个工具。表计行业总量和智能表渗透率的未来趋势。全球范围内的表计行业总量和智能表的渗透率都会加速上行，市场价值也会翻倍。全球智能表行业的发展空间和竞争情况。全世界市场潜力很大，但竞争已经很激烈，需要转型做其他东西。全球智能表行业的发展空间至少有十年，但竞争已经很激烈。智能表行业在不同地区的发展情况。非洲换装率很低，东南亚和亚洲除中国以外的地方换装率也很低，中东几个主要国家都已经换完了。,淘宝 退货包运费,0
湖南材料的性能优势。湖南材料的强度较高，比PPT更适合对密封性和保质期要求较高的产品，如啤酒瓶和医药试剂等。对于这些对组合能力要求较高的产品，湖南材料比PPT更适合，因此在未来增长中，包括啤酒瓶市场在内的销量最大的下游领域将是主要的增长点。近期平片价格及价差。近期平片价格基本上在400-420元之间，每吨毛利在360元左右，毛利价差大约在700-800元之间。公司的原材料价格及走势。7月和8月的价差相对稳定，维持在600-800元之间。公司按照年度长协的方式采购原材料，并锁定了基本的价格情况。公司的原材料采购模式。公司的原材料采购模式主要有两种，一种是锁量不锁价，价格是按均价计算，量是有保证的；另一种是为了对冲原材料波动带来的利润的波动，与大的贸易商签订锁量锁价的合同。这两种方式都会根据订单和库存情况进行配置。淘宝方面的原料和产品贸易。公司现在仍在进行淘宝方面的原料和产品贸易，并有一些套保功能，可以在国内期货市场上进行操作，也可以直接与国内大的贸易商签订锁价合同。头部企业协同共同应对波动的情况。目前头部企业占据了市场超过80%的份额。今年我们国内新增产能较少，但是近期有一些新增产能项目批下来，会导致未来产能释放较大。目前头部企业之间还没有建立起默契或协商机制，所以目前还没有采取共同协同的行动。头部企业的盈利水平和可能的零售。头部企业的盈利水平差距不大，目前还没有出现不可接受的利润情况。虽然理论上存在共同行动的可能性，但目前尚未到达这个地步，每家企业都有盈利的情况。此外，各企业的产业布局和销售半径也会对行动产生影响。上半年研发投入情况。上半年的整个研发投入相比去年同期翻了一倍，但下半年的增长情况尚不详细。,淘宝 退货包运费,0
中国鱼子酱产量占全球六成。根据数据显示，中国目前的鱼子酱产量占据了全球的六成。这意味着中国是全球最大的鱼子酱生产国之一，拥有庞大的鱼子酱市场。国产鱼子酱通过天猫销售走进千家万户。杭州千岛湖鲟龙科技股份有限公司是中国最大的鱼子酱生产企业之一，他们通过天猫平台销售的鱼子酱年销售额超过千万。这表明国产鱼子酱通过天猫的渠道走进了千家万户，消费者可以以较低的价格享受到高质量的鱼子酱。国产鱼子酱受到越来越多消费者的喜爱。随着年轻人开始尝试将鱼子酱带入日常生活，国产鱼子酱的质量有保证且价格能够负担得起，因此受到了越来越多消费者的喜爱。高复购率也证明了国产鱼子酱通过天猫走进了千家万户，成为消费者喜爱的食品之一。国产威士忌价格相对较低且在南方城市消费前十占据大部分份额。报告显示，国产威士忌的均价相对较低，大约是同规格进口威士忌价格的五分之一左右。此外，在南方城市消费前十的城市中，有九个城市消费国产威士忌居多。这表明国产威士忌在价格和消费市场上具有竞争力。农业资源的挖掘和加工对地方农业产业发展具有重要意义。中国拥有丰富的农业资源，但目前仍有许多资源未被挖掘和开发。农业资源是农产品加工全产业链中至关重要的一环。通过挖掘和加工农业资源，可以实现农产品的本土化、现代化和产业化，促进地方农业产业的高质量发展。《淘宝隐藏土特产报告》为挖掘特色农业资源、发展特色优势产业提供了有效信息。《淘宝隐藏土特产报告》的发布对挖掘特色农业资源、发展特色优势产业具有重要意义。这份报告提供了有效的信息，可以帮助各地发现和开发隐藏的土特产，推动地方特色优势产业的发展。隐形土特产正成为推动各地产业振兴的潜力股。隐形土特产是指那些以前被人们忽视或未被充分开发的特色农产品。随着对特色农产品的挖掘和加工，这些隐藏的土特产正逐渐成为推动各地产业振兴的潜力股。通过发展特色农产品，可以促进地方经济的发展和农民收入的增加。,淘宝 退货包运费,0
共享员工管理模式。肯德基未来可能会建立共享员工的管理模式，但目前还未尝试过。餐厅经理和店长会自己招人管理，员工不太会被调到其他店铺工作，除非经理兼管其他店铺。城市产品销售差异。肯德基销售数据中，一线城市与四线城市的产品销售额有所差别，例如一线城市的咖啡销售较好，而低线城市的肌肉类产品销售较多。本土化产品在高低线城市销售情况也有所不同。营销费用投放。肯德基整体营销费用占比为5%左右，投放在各大平台上，其中抖音、微信、腾讯视频、支付宝、淘宝等为重点。具体投放在各大平台的核心策略需要收集。区域菜单销售情况。肯德基的区域菜单在高低线城市销售情况不同，具体数据需要收集。采购数据中有各个品类的分布，但具体销售数据也需要收集。餐厅经理和店长管理。餐厅经理和店长会自己招人管理，员工不太会被调到其他店铺工作，除非经理兼管其他店铺。采购数据分布。肯德基的采购数据中有各个品类的分布，但具体销售数据需要收集。投放平台策略。肯德基投放在各大平台的核心策略需要收集，重点投放在抖音、微信、腾讯视频、支付宝、淘宝等平台。,淘宝 退货包运费,0
公司项目进展。公司的3.5万吨项目已经完成调试达标，但未达到满产。安哥拉项目去年完成了专项工作，并计划在今年继续实施。地缘政治风险。公司的地缘政治风险较少，北美IIRA法案对加拿大项目的影响不大。金属布局和非洲稀土项目。公司正在布局稀有金属和能源金属，同时也在关注非洲稀土项目。如厕业务规划和全球格局。如厕业务市场相对较小，但公司在射精化工市场和高温高压游戏领域中有竞争优势。市场趋势稳定。色资源储量和产量展望。加拿大探物矿山是公司色资源储量的主要来源，但资源量不确定，需要进行勘探。开采过程中的机械化或半机械化分离导致产量不稳定。国内外资源布局和产能规划。公司计划在国内和海外布局资源，国内计划以6万吨的冶炼产能为基础，海外计划在加拿大建设100亿选项的项目，并在津巴布韦皮下矿山进行现场冶炼。资源布局方案正在优化，成本优势和资源利用优势是考虑的因素。公司10万吨的规划基本没有改变，按照这个计划进行建设和布局。资源端调整对企业影响。行业内的资源端调整是根据自身情况做出的调整和变化，对公司项目的影响不大。公司对整个铝行业和新能源的发展持乐观态度。期货工具和非洲矿产资源开发利用。公司目前对期货工具的应用较小，将其作为淘宝工具，等市场成熟后再考虑扩大应用。公司认为非洲矿产资源对中国来说具有优势，尤其是锂资源。对于非洲矿山的运费、税率和汇兑损益问题，公司正在进行谈判和制定方案。今年的汇率损益预计会有改善。运费控制在180美元一吨。,淘宝 退货包运费,0
互影科技的背景和投资。互影科技是深耕于互动数字内容和AIMR等前沿科技的公司，已获得多家头部机构和公司的投资。他们与上影集团、阅文集团等合作发布了双人互动荧幕游戏《蝶影成双》和线上互动影视游戏《代号新世界》。数字化内容发展的趋势。从诺基亚时代到智能手机时代，我们见证了重大变革。新硬件的出现带来了全新交互方式和应用形态的诞生。现在MR硬件通过手势、眼动、表情等交互方式创造了新的应用可能性。新技术带来的内容体验。新技术如个性化推荐通过用户实时交互数据生成个性化标签，极大提高了信息分发效率。这种技术创新推动了头条、抖音、移动淘宝等应用的兴起。MR与AI的融合趋势。MR与AI的融合将进一步拓展内容创作和应用的可能性。通过结合MR的交互方式和AI的智能分析，可以提供更加沉浸式和个性化的内容体验。市场增长规模的决定因素。市场的增长规模由硬件数量和用户付费能力的乘积决定。因此，内容创作者更关注硬件数量和用户的付费能力，以决策在应用和内容开发上的投入。互影科技的期待。互影科技期待他们的作品能够上市并获得成功。他们将继续深耕于互动数字内容和前沿科技，为用户带来全新的内容体验。,淘宝 退货包运费,0
